{
  "schema_version": "obs.trigger_decision.v1",
  "decision_id": "TD-001",
  "policy_id": "default-symptom-trigger-policy",
  "rule_id": "memory_pressure_low_v1",
  "trigger_name": "memory_pressure_low",
  "trigger_kind": "threshold",
  "decision": "fired",
  "decision_reason": "threshold_crossed",
  "signal_id": "memory.available_percent",
  "coverage_signal_id": "memory.summary",
  "observed_value": 12.5,
  "threshold": 20.0,
  "coverage_state": "partial",
  "coverage_confidence": "medium",
  "coverage_ref": "artifact://recorder/incidents/INC-TRIGGER-001/coverage.json",
  "budget_decision": "accepted",
  "budget_status_ref": null,
  "incident_id": "INC-TRIGGER-001",
  "trigger_event_ref": "artifact://recorder/incidents/INC-TRIGGER-001/trigger_event.json",
  "root_cause_claim": false,
  "data_quality": {
    "dropped": false,
    "drop_count": 0,
    "throttled": false,
    "missing": [],
    "truncated": false,
    "clock_confidence": "medium",
    "notes": ["trigger decision is a preservation decision, not a cause claim"]
  }
}
